{
  "manifestVersion": "1.0.0",
  "backend": "python@0.1.0",
  "runtimeVersion": "0.1.0",
  "contracts": "1.0.0-alpha.1",
  "workflows": [
    {
      "workflowId": "gw_a",
      "revision": 1,
      "irHash": "sha256:e1f876d3d871875dc0bf1ad05b88bd481a9be72ef1cb9d80c5fffe5da4cc1be8"
    }
  ],
  "ownedRoots": [
    "app/src/generated/",
    "app/tests/generated/"
  ],
  "files": [
    {
      "path": "app/src/generated/__init__.py",
      "sha256": "d757a2837f53e682e10ec1e4657221594fabc5c2c7d5fb13f08dced08ef3aaa0",
      "role": "source"
    },
    {
      "path": "app/src/generated/app.py",
      "sha256": "b6156fba3c41991ae67ff4d8c84d97351d738655ab385026fb204ad4c1d52415",
      "role": "source"
    },
    {
      "path": "app/src/generated/sourcemap/stable_overspeed_warning.map.json",
      "sha256": "d8e6fef5edf8649f458802c1dfb095533a04f55cd50f620f5319fd2697c67ac4",
      "role": "config"
    },
    {
      "path": "app/src/generated/workflows/__init__.py",
      "sha256": "11df2ad09115fc1f5d3b5b8a9360459eda0d2a1b862a7acbab09d9ee45571f00",
      "role": "source"
    },
    {
      "path": "app/src/generated/workflows/stable_overspeed_warning.py",
      "sha256": "0b27b1c023bd2a0f5aec44af77cdad151d17ecf379a6649d312944ad39a42695",
      "role": "source"
    },
    {
      "path": "app/tests/generated/conftest.py",
      "sha256": "043a55a25b1afe04e03194da45b8d6492d5eff25a52ccc56ce01abe9204c5de5",
      "role": "test"
    },
    {
      "path": "app/tests/generated/test_stable_overspeed_warning.py",
      "sha256": "3b1c446bb5bd0f1a59925c19e4f07ca741e5f228c8a36ed7cf702cc23c8025a2",
      "role": "test"
    }
  ]
}
