{
  "manifestVersion": "1.0.0",
  "backend": "rust-wasm@0.1.0",
  "target": {
    "kind": "wasm",
    "triple": "wasm32-wasip1",
    "abi": "sv-wasm-abi/1",
    "host": {
      "name": "sv-wasm-host",
      "version": "0.1.0"
    }
  },
  "runtimeVersion": "0.1.0",
  "contracts": "1.0.0-alpha.1",
  "workflows": [
    {
      "workflowId": "gw_f",
      "revision": 1,
      "irHash": "sha256:5a1b3deaee0493022195cff3b084acde7c1036d5c98b5dd5adcaf6d05b9a2195"
    }
  ],
  "ownedRoots": [
    "app/src/generated/",
    "app/tests/generated/"
  ],
  "files": [
    {
      "path": "app/src/generated/app.rs",
      "sha256": "9f16ab6eac006e18a0f6e15e30e9f9884c92859082727e6406f5a61a86c9c55e",
      "role": "source"
    },
    {
      "path": "app/src/generated/mod.rs",
      "sha256": "d024e05df29aa4ebe7d3888afb23eb15d0f16cb82d5af1a31970a2670e4192fa",
      "role": "source"
    },
    {
      "path": "app/src/generated/sourcemap/welcome_sequence.map.json",
      "sha256": "a5bc2866d1dd45011067a2222daaccc24b02ae5d1526feb4f8c7c83d0fcccb7b",
      "role": "config"
    },
    {
      "path": "app/src/generated/sv-app.json",
      "sha256": "5b847001926def3cb129c044e66ba519b2ceb6d44438fb68dfc9223f29cfb68f",
      "role": "config"
    },
    {
      "path": "app/src/generated/wasm.rs",
      "sha256": "9d495cc88ef20ba68299a3b25e2443f061b56fac92dc94a958ba002dd1d728b8",
      "role": "source"
    },
    {
      "path": "app/src/generated/workflows/mod.rs",
      "sha256": "a2dbc7a710198c9c4275cf5c6b78ce03a7d13daa4b2bee211e77a1e3312b507a",
      "role": "source"
    },
    {
      "path": "app/src/generated/workflows/welcome_sequence.rs",
      "sha256": "146c7e50c50b32803f5fda13acd1ca54413006f0b31bb816c8b933b9a8abaf0b",
      "role": "source"
    },
    {
      "path": "app/tests/generated/cases.json",
      "sha256": "f12996b3cba8dc81003cfc3606afe595b466b8ecd7ead39aaebc3f4ea0d2dcb8",
      "role": "test"
    }
  ]
}
