{
  "manifestVersion": "1.0.0",
  "backend": "python@0.1.0",
  "runtimeVersion": "0.1.0",
  "contracts": "1.0.0-alpha.1",
  "workflows": [
    {
      "workflowId": "gw_g",
      "revision": 1,
      "irHash": "sha256:0175761c5a77755a56ea7f3cd8aae1b95c7ab5563a527bb3d1e407c9586184ce"
    }
  ],
  "ownedRoots": [
    "app/src/generated/",
    "app/tests/generated/"
  ],
  "files": [
    {
      "path": "app/src/generated/__init__.py",
      "sha256": "a1b71d7f36344d83c7eb0afdf483657c1bd72573ef0b6de8fcc61b7095751a7c",
      "role": "source"
    },
    {
      "path": "app/src/generated/app.py",
      "sha256": "e8cd7582c7b51ba8cc7179403aa1c02b07f3f264006050c283280537ed3d41e9",
      "role": "source"
    },
    {
      "path": "app/src/generated/sourcemap/window_close_on_rain.map.json",
      "sha256": "2a36f444c07577980d7cbe8799c05e0b2256b3c6ef8d487bf2d913121219897e",
      "role": "config"
    },
    {
      "path": "app/src/generated/workflows/__init__.py",
      "sha256": "d7f7f2b79ce52c0ebce18fcd4bf3f50eed16aa706eae623a5250c96b8c9684be",
      "role": "source"
    },
    {
      "path": "app/src/generated/workflows/window_close_on_rain.py",
      "sha256": "0e69133036704a9e4e231caeba18acdd4d714dee92aa5cf98d00661b06879bf3",
      "role": "source"
    },
    {
      "path": "app/tests/generated/conftest.py",
      "sha256": "043a55a25b1afe04e03194da45b8d6492d5eff25a52ccc56ce01abe9204c5de5",
      "role": "test"
    },
    {
      "path": "app/tests/generated/test_window_close_on_rain.py",
      "sha256": "b93e9473c749644239551259c3391809b0a40b7b9ed6b42e22053539d84a2841",
      "role": "test"
    }
  ]
}
