{
  "manifestVersion": "1.0.0",
  "backend": "rust-wasm@0.1.0",
  "target": {
    "kind": "wasm",
    "triple": "wasm32-wasip1",
    "abi": "sv-wasm-abi/1",
    "host": {
      "name": "sv-wasm-host",
      "version": "0.1.0"
    }
  },
  "runtimeVersion": "0.1.0",
  "contracts": "1.0.0-alpha.1",
  "workflows": [
    {
      "workflowId": "gw_c",
      "revision": 1,
      "irHash": "sha256:bc1e3bf33a1b354a68eb7697c09be91013ccf8c1b4ae5565d86250b099429f0e"
    }
  ],
  "ownedRoots": [
    "app/src/generated/",
    "app/tests/generated/"
  ],
  "files": [
    {
      "path": "app/src/generated/app.rs",
      "sha256": "ff692c4e54b048bb168b4213ee2729e87778f4db96b0adca3f4486af8578a7dd",
      "role": "source"
    },
    {
      "path": "app/src/generated/mod.rs",
      "sha256": "fbbaf6704440c24646e41bca128239fc677e5af44695333434a1ec635d84c945",
      "role": "source"
    },
    {
      "path": "app/src/generated/sourcemap/auto_wipers.map.json",
      "sha256": "e417fff20d45d054fbf919558aae07b920f539904b13611978b5a1b36eadee34",
      "role": "config"
    },
    {
      "path": "app/src/generated/sv-app.json",
      "sha256": "e0e1c0c2b7e3d5dedebd661ce2decfa666eb73c91087d3ceb40840ea013b65a2",
      "role": "config"
    },
    {
      "path": "app/src/generated/wasm.rs",
      "sha256": "6b094c5256196fd8738981b52693564dafc009eeb3cdcbe9622413bd25998439",
      "role": "source"
    },
    {
      "path": "app/src/generated/workflows/auto_wipers.rs",
      "sha256": "29020e2126e119042d35e61e458bb52248a43b8bb995bba165433225d6da6967",
      "role": "source"
    },
    {
      "path": "app/src/generated/workflows/mod.rs",
      "sha256": "4a4115846d76ee7c0f46f091b834b8565513e25cf7160dc9a4982f6f18c4b4c0",
      "role": "source"
    },
    {
      "path": "app/tests/generated/cases.json",
      "sha256": "fdfbb25d164c194938c66e52b9f9a3335c70592b71ad71b1b9fa52c4576faaf2",
      "role": "test"
    }
  ]
}
