{
  "manifestVersion": "1.0.0",
  "backend": "rust-wasm@0.1.0",
  "target": {
    "kind": "wasm",
    "triple": "wasm32-wasip1",
    "abi": "sv-wasm-abi/1",
    "host": {
      "name": "sv-wasm-host",
      "version": "0.1.0"
    }
  },
  "runtimeVersion": "0.1.0",
  "contracts": "1.0.0-alpha.1",
  "workflows": [
    {
      "workflowId": "gw_e",
      "revision": 1,
      "irHash": "sha256:77be02a978f54386a11eded8c64a0b9fe9e91508d154b7a6641ff7996deb1c03"
    }
  ],
  "ownedRoots": [
    "app/src/generated/",
    "app/tests/generated/"
  ],
  "files": [
    {
      "path": "app/src/generated/app.rs",
      "sha256": "f5016296959a039efbfbaf6682884d94bce889412379192177a08c894898c074",
      "role": "source"
    },
    {
      "path": "app/src/generated/mod.rs",
      "sha256": "3e0592fe471d5bd318143fcdf31774ef4ae748bd957d6b9dcffad267f02d4780",
      "role": "source"
    },
    {
      "path": "app/src/generated/sourcemap/periodic_telemetry.map.json",
      "sha256": "4bc52f9d9e67232678ebd7dc13ac043d75b412584bc5684560fd3a4033aa7cf1",
      "role": "config"
    },
    {
      "path": "app/src/generated/sv-app.json",
      "sha256": "a7ff75c84cf31fd29daab49228c029386e57fa7dbae307b3a587fd8f7b92ef87",
      "role": "config"
    },
    {
      "path": "app/src/generated/wasm.rs",
      "sha256": "3587d20cd227daecc767145487444ea38d3f523935e681ea75902d1479948d45",
      "role": "source"
    },
    {
      "path": "app/src/generated/workflows/mod.rs",
      "sha256": "88aa130dabd2c443d4a0e76196afb251868101c709a2843a7302ca600ccf20ee",
      "role": "source"
    },
    {
      "path": "app/src/generated/workflows/periodic_telemetry.rs",
      "sha256": "ef32b7624d1ddf942275ec3bf656a1156377a7adaa1add92e8a4bd3b51484a70",
      "role": "source"
    },
    {
      "path": "app/tests/generated/cases.json",
      "sha256": "997e46a89107f7f3fdb2fa157e7610dadcb6756b334a7d487cbf77622021f267",
      "role": "test"
    }
  ]
}
