{
  "manifestVersion": "1.0.0",
  "backend": "cpp@0.1.0",
  "runtimeVersion": "0.1.0",
  "contracts": "1.0.0-alpha.1",
  "workflows": [
    {
      "workflowId": "gw_f",
      "revision": 1,
      "irHash": "sha256:5a1b3deaee0493022195cff3b084acde7c1036d5c98b5dd5adcaf6d05b9a2195"
    }
  ],
  "ownedRoots": [
    "app/src/generated/",
    "app/tests/generated/"
  ],
  "files": [
    {
      "path": "app/src/generated/.clang-format",
      "sha256": "a8322bda3e36aba81847db8dfef5acbb0b781c0cb42cb4b18ee731778de66d83",
      "role": "config"
    },
    {
      "path": "app/src/generated/Main.cpp",
      "sha256": "3c64a04690d83be521f88d910db6294905cd2c92e46f4e74fcb93c895158087c",
      "role": "source"
    },
    {
      "path": "app/src/generated/SimVehicleApp.cpp",
      "sha256": "e3af4d68231dba68a5b771f6f577028f1aa456ee3e0dcd2bc49a85a9c96c77cf",
      "role": "source"
    },
    {
      "path": "app/src/generated/SimVehicleApp.hpp",
      "sha256": "21f8f61682f63589ce42dd5b9f52cc3d8bbe6f7f268a3afcbc77ffc2d4dbdb98",
      "role": "header"
    },
    {
      "path": "app/src/generated/generated.cmake",
      "sha256": "b5a4fa6435f736700d47ba32f8c715fa2905ef57e61f8653ab984f26815a6d4f",
      "role": "build"
    },
    {
      "path": "app/src/generated/sourcemap/WelcomeSequence.map.json",
      "sha256": "1caa06dacb3b2334f64f32a9bbb0c04e0a8ace82b0194714fc842720b70b874d",
      "role": "config"
    },
    {
      "path": "app/src/generated/workflows/WelcomeSequence.cpp",
      "sha256": "d3e5110891b579f963f8b64ad5e493defd643e1ab48113ef6373475a82ac494c",
      "role": "source"
    },
    {
      "path": "app/src/generated/workflows/WelcomeSequence.hpp",
      "sha256": "0eab8cfd6dc190c5c796aa97657508a2c721b009e9fbe178734fb99cdb568930",
      "role": "header"
    },
    {
      "path": "app/tests/generated/CMakeLists.txt",
      "sha256": "3d8bb3976b58f9386f020c8de953fa28f856b502190154c0f5436fdd676ab102",
      "role": "build"
    },
    {
      "path": "app/tests/generated/WelcomeSequence_test.cpp",
      "sha256": "0725e54ed0af56f66d18b911447eedda5df4c9fc220833b0df72d0f42be854ab",
      "role": "test"
    }
  ]
}
